{
  "schema_version": "0.1.0",
  "registry_id": "trusted-source-registry",
  "authority_boundary": "Trust tiers lower intake friction only. Every external item still passes screening (prompt injection, license, provenance, compatibility) and a named human approval before promotion. A tier never authorizes copying external content into DAD or downstream repos.",
  "trust_tiers": {
    "high_signal": "Frontier labs, professional security firms, and language foundations with strong review culture; intake allowed without extra justification.",
    "known": "Curated community sources with real editorial filtering; intake allowed without extra justification but screen skeptically.",
    "unknown": "Everything else; intake requires an explicit written justification."
  },
  "sources": [
    {
      "source_id": "anthropic",
      "label": "Anthropic (engineering blog, docs, official repos)",
      "url_patterns": ["anthropic.com", "claude.com", "github.com/anthropics"],
      "trust_tier": "high_signal",
      "check_cadence": "monthly",
      "frontier_watch": ["agent instruction design", "evaluation harnesses", "model behavior research"],
      "intake_actions": ["Record pointer-only candidates; route coding-review ideas to harness discovery."],
      "asset_kinds": ["skill", "harness", "doc", "lesson"],
      "review_status": "reviewed"
    },
    {
      "source_id": "openai",
      "label": "OpenAI (blog, developers site, official repos)",
      "url_patterns": ["openai.com", "developers.openai.com", "github.com/openai"],
      "trust_tier": "high_signal",
      "check_cadence": "monthly",
      "frontier_watch": ["agent tooling", "evals", "model routing", "coding-agent workflows"],
      "intake_actions": ["Record pointer-only candidates; cite official docs before OpenAI implementation changes."],
      "asset_kinds": ["skill", "harness", "doc", "lesson"],
      "review_status": "reviewed"
    },
    {
      "source_id": "trailofbits",
      "label": "Trail of Bits (security skills, Testing Handbook)",
      "url_patterns": ["github.com/trailofbits", "trailofbits.com", "appsec.guide"],
      "trust_tier": "high_signal",
      "check_cadence": "monthly",
      "frontier_watch": ["security testing", "fuzzing", "review harnesses", "supply-chain safety"],
      "intake_actions": ["Prefer harness ideas and red-team rubrics; do not copy third-party skill bodies."],
      "asset_kinds": ["skill", "harness", "doc"],
      "review_status": "reviewed"
    },
    {
      "source_id": "google",
      "label": "Google (Comprehensive Rust, official org repos)",
      "url_patterns": ["github.com/google", "google.github.io"],
      "trust_tier": "high_signal",
      "check_cadence": "quarterly",
      "language_focus": ["rust", "python", "mixed"],
      "frontier_watch": ["Rust teaching patterns", "AI-legible examples", "large-codebase engineering practices"],
      "intake_actions": ["Route reusable language guidance through research intake as pointer-only docs."],
      "asset_kinds": ["doc", "harness", "lesson"],
      "review_status": "reviewed"
    },
    {
      "source_id": "rust-lang",
      "label": "Rust project (official docs, blogs, RFCs, crates, project goals)",
      "url_patterns": [
        "rust-lang.org",
        "blog.rust-lang.org",
        "blog.rust-lang.org/inside-rust",
        "internals.rust-lang.org",
        "rust-lang.github.io",
        "rust-lang.github.io/rust-project-goals",
        "doc.rust-lang.org",
        "github.com/rust-lang",
        "github.com/rust-lang/rfcs",
        "crates.io"
      ],
      "trust_tier": "high_signal",
      "check_cadence": "weekly",
      "language_focus": ["rust"],
      "frontier_watch": [
        "new stabilized language and stdlib features",
        "annual and initiative-level project goals that may change DAD's Rust roadmap",
        "compiler and cargo roadmap changes",
        "RFCs affecting API design, async, unsafe boundaries, or performance",
        "official crate and toolchain changes that improve deterministic scanning, parsing, hashing, or static analysis"
      ],
      "intake_actions": [
        "Update Rust buildout guidance only after screening and a human-reviewed DAD promotion.",
        "Prefer small harness experiments before recommending Rust in downstream repos."
      ],
      "asset_kinds": ["doc", "harness", "asset", "lesson"],
      "review_status": "reviewed"
    },
    {
      "source_id": "rust-community-frontier",
      "label": "Rust community frontier feeds (This Week in Rust, performance book, Tokio blog)",
      "url_patterns": ["this-week-in-rust.org", "nnethercote.github.io/perf-book", "tokio.rs/blog"],
      "trust_tier": "known",
      "check_cadence": "weekly",
      "language_focus": ["rust"],
      "frontier_watch": [
        "performance techniques",
        "async runtime lessons",
        "new crates worth evaluating",
        "anti-patterns that AI agents may miss because they are underrepresented in generic code corpora"
      ],
      "intake_actions": [
        "Create research-intake records for candidate crates or idioms; keep claims candidate-only until DAD evals exist.",
        "Translate repeated patterns into harness research questions instead of direct style rules."
      ],
      "asset_kinds": ["doc", "harness", "lesson"],
      "review_status": "reviewed"
    },
    {
      "source_id": "rust-ecosystem-curation",
      "label": "Rust ecosystem curation and crate discovery",
      "url_patterns": ["lib.rs", "docs.rs", "blessed.rs", "github.com/rust-unofficial/awesome-rust"],
      "trust_tier": "known",
      "check_cadence": "monthly",
      "language_focus": ["rust"],
      "frontier_watch": [
        "crates that may improve DAD scanning, parsing, chunking, hashing, static analysis, or single-binary validation",
        "ecosystem patterns that are common among experienced Rust developers but underrepresented in generic AI-generated code",
        "maintenance, license, security, and compatibility signals before any crate enters a DAD harness"
      ],
      "intake_actions": [
        "Create pointer-only research intake records; do not vendor crate code or docs into DAD.",
        "Require a local harness experiment, license check, and maintenance note before recommending a crate to downstream repos."
      ],
      "asset_kinds": ["doc", "harness", "asset", "lesson"],
      "review_status": "reviewed"
    },
    {
      "source_id": "rust-security",
      "label": "RustSec and Rust security advisory sources",
      "url_patterns": ["rustsec.org", "github.com/rustsec"],
      "trust_tier": "high_signal",
      "check_cadence": "weekly",
      "language_focus": ["rust"],
      "frontier_watch": ["dependency advisories", "unsafe-code hazards", "supply-chain controls"],
      "intake_actions": ["Route security-relevant changes to governance notices or harness checks; never auto-upgrade dependencies by mail."],
      "asset_kinds": ["doc", "lesson", "harness"],
      "review_status": "reviewed"
    },
    {
      "source_id": "rust-fuzz",
      "label": "Rust fuzzing and property-test projects",
      "url_patterns": ["rust-fuzz.github.io", "github.com/rust-fuzz", "github.com/BurntSushi/quickcheck", "github.com/proptest-rs"],
      "trust_tier": "known",
      "check_cadence": "monthly",
      "language_focus": ["rust"],
      "frontier_watch": [
        "fuzz target patterns for parsers, scanners, serializers, and chunkers",
        "property-based invariant tests that catch edge cases ordinary examples miss",
        "coverage-guided regression corpus management that stays pointer-only in DAD"
      ],
      "intake_actions": [
        "Route fuzzing ideas to harness candidates with minimized public-safe examples.",
        "Do not copy generated corpora, private inputs, or crash artifacts into DAD mail."
      ],
      "asset_kinds": ["doc", "harness", "lesson"],
      "review_status": "reviewed"
    },
    {
      "source_id": "rust-test-frontier",
      "label": "Rust test orchestration frontier",
      "url_patterns": ["nexte.st", "github.com/nextest-rs"],
      "trust_tier": "known",
      "check_cadence": "monthly",
      "language_focus": ["rust"],
      "frontier_watch": [
        "isolated and partitioned Rust test execution",
        "machine-readable test output that can feed parity and governance reports",
        "test-runner configuration patterns that reduce false green reports"
      ],
      "intake_actions": [
        "Evaluate test-runner ideas through local harness outcomes before recommending defaults.",
        "Keep timing claims behind same-workload and same-scope evidence."
      ],
      "asset_kinds": ["doc", "harness", "lesson"],
      "review_status": "reviewed"
    },
    {
      "source_id": "pyo3",
      "label": "PyO3 / maturin project",
      "url_patterns": ["pyo3.rs", "maturin.rs", "github.com/pyo3"],
      "trust_tier": "high_signal",
      "check_cadence": "monthly",
      "language_focus": ["python", "rust", "mixed"],
      "frontier_watch": ["Python-to-Rust extension ergonomics", "ABI and wheel changes", "build tooling"],
      "intake_actions": ["Update Python-to-Rust guidance only after parity and packaging checks."],
      "asset_kinds": ["doc", "asset"],
      "review_status": "reviewed"
    },
    {
      "source_id": "python-core",
      "label": "Python core project (PEPs, dev guide, core discussions, CPython)",
      "url_patterns": [
        "python.org",
        "peps.python.org",
        "devguide.python.org",
        "discuss.python.org",
        "blog.python.org",
        "github.com/python/cpython"
      ],
      "trust_tier": "high_signal",
      "check_cadence": "weekly",
      "language_focus": ["python"],
      "frontier_watch": [
        "new or accepted PEPs affecting language features, typing, packaging, performance, or concurrency",
        "stdlib features underused by AI agents",
        "CPython performance or diagnostics work",